{
  "$schema": "./hardening-roadmap.schema.json",
  "schemaVersion": 1,
  "roadmap": "Coordinate @hasna/snapshots hardening across 17 roadmap workstreams",
  "closurePolicy": {
    "umbrellaKey": "SNA-umbrella",
    "workstreamKeys": [
      "SNA-00001",
      "SNA-00002",
      "SNA-00003",
      "SNA-00004",
      "SNA-00005",
      "SNA-00006",
      "SNA-00007",
      "SNA-00008",
      "SNA-00009",
      "SNA-00010",
      "SNA-00011",
      "SNA-00012",
      "SNA-00013",
      "SNA-00014",
      "SNA-00015",
      "SNA-00016"
    ],
    "requiredEvidence": [
      "implementation",
      "tests",
      "docs",
      "machine011"
    ],
    "machineValidation": {
      "machine": "machine011",
      "minimumPositiveControls": 1
    }
  },
  "items": [
    {
      "key": "SNA-umbrella",
      "title": "Coordinate @hasna/snapshots hardening across 17 roadmap workstreams",
      "todosTaskId": "edd6155e-fa09-4e30-bc2b-d0f13dd4c0a7",
      "dependsOn": [
        "SNA-00001",
        "SNA-00002",
        "SNA-00003",
        "SNA-00004",
        "SNA-00005",
        "SNA-00006",
        "SNA-00007",
        "SNA-00008",
        "SNA-00009",
        "SNA-00010",
        "SNA-00011",
        "SNA-00012",
        "SNA-00013",
        "SNA-00014",
        "SNA-00015",
        "SNA-00016"
      ],
      "blockers": []
    },
    {
      "key": "SNA-00001",
      "title": "Capture adapter for systemd user services",
      "todosTaskId": "ca75ff8c-6990-42c5-9f6c-52ea7bc42617",
      "dependsOn": [],
      "blockers": []
    },
    {
      "key": "SNA-00002",
      "title": "Capture adapter for Docker containers",
      "todosTaskId": "db76de00-0d50-4d68-ad24-90fb89a768da",
      "dependsOn": [],
      "blockers": []
    },
    {
      "key": "SNA-00003",
      "title": "Capture adapter for loops daemon + servers CLI state",
      "todosTaskId": "1eeb1817-40a6-4f1a-b97d-93792ee4b847",
      "dependsOn": [],
      "blockers": []
    },
    {
      "key": "SNA-00004",
      "title": "snapshots diff between two snapshots",
      "todosTaskId": "17069f97-ebc4-4898-9823-e2b2fd254163",
      "dependsOn": [],
      "blockers": []
    },
    {
      "key": "SNA-00005",
      "title": "Retention + GC (snapshots prune)",
      "todosTaskId": "b26be1e2-990b-4c79-be7c-8f1d49a55532",
      "dependsOn": [],
      "blockers": []
    },
    {
      "key": "SNA-00006",
      "title": "Scheduled auto-capture via the agent",
      "todosTaskId": "09984989-9495-4639-abcc-084e48400294",
      "dependsOn": [],
      "blockers": []
    },
    {
      "key": "SNA-00007",
      "title": "Restore adapter for systemd user services (plan-only)",
      "todosTaskId": "b605cd69-0793-4c63-8a4a-587c92bc7b70",
      "dependsOn": [
        "SNA-00001"
      ],
      "blockers": []
    },
    {
      "key": "SNA-00008",
      "title": "Add snapshots uninstall/remove command",
      "todosTaskId": "d1a9feb8-834f-4981-9c21-0a1e394f54bd",
      "dependsOn": [],
      "blockers": []
    },
    {
      "key": "SNA-00009",
      "title": "Opt-in @hasna/cloud storage backend for DR",
      "todosTaskId": "7dc492d9-97fb-4af7-8341-e358b72fee6f",
      "dependsOn": [],
      "blockers": []
    },
    {
      "key": "SNA-00010",
      "title": "PostgreSQL migrations + @hasna/cloud + feedback for team storage",
      "todosTaskId": "347cb508-2ec8-42cd-b782-228e1bede115",
      "dependsOn": [
        "SNA-00009"
      ],
      "blockers": []
    },
    {
      "key": "SNA-00011",
      "title": "Refactor src/restore.ts (873 LOC) into per-resource adapters",
      "todosTaskId": "cb06df4f-867e-4487-89c4-c89c6570de47",
      "dependsOn": [],
      "blockers": []
    },
    {
      "key": "SNA-00012",
      "title": "Harden the MCP server",
      "todosTaskId": "aca9043b-62e8-48e1-8ecd-06f01007d8f7",
      "dependsOn": [],
      "blockers": []
    },
    {
      "key": "SNA-00013",
      "title": "Extend tests coverage",
      "dependsOn": [
        "SNA-00001",
        "SNA-00002",
        "SNA-00003",
        "SNA-00004",
        "SNA-00005",
        "SNA-00006",
        "SNA-00007",
        "SNA-00008",
        "SNA-00009",
        "SNA-00010",
        "SNA-00011",
        "SNA-00012"
      ],
      "blockers": []
    },
    {
      "key": "SNA-00014",
      "title": "Green test suite + typecheck/build in CI",
      "todosTaskId": "470d8960-b442-425c-919d-3ab7cb6d03b7",
      "dependsOn": [
        "SNA-00013"
      ],
      "blockers": []
    },
    {
      "key": "SNA-00015",
      "title": "Repository LOC audit and refactor oversized sources",
      "dependsOn": [],
      "blockers": []
    },
    {
      "key": "SNA-00016",
      "title": "Prepare release (npm publish)",
      "todosTaskId": "56c996bd-8f27-47a4-8713-314194adc8c4",
      "dependsOn": [
        "SNA-00001",
        "SNA-00002",
        "SNA-00003",
        "SNA-00004",
        "SNA-00005",
        "SNA-00006",
        "SNA-00007",
        "SNA-00008",
        "SNA-00009",
        "SNA-00010",
        "SNA-00011",
        "SNA-00012",
        "SNA-00013",
        "SNA-00014",
        "SNA-00015"
      ],
      "blockers": []
    }
  ]
}
